{
  "$schema": "../../schemas/resource-schema.json",
  "uri": "examples://workflows/create-and-run",
  "name": "Complete Create and Run Workflow",
  "description": "Step-by-step example of creating an assistant, thread, and running a conversation",
  "mimeType": "text/markdown",
  "category": "examples",
  "tags": ["workflow", "example", "tutorial", "assistant"],
  "contentType": "markdown",
  "content": "# Complete Workflow: Create Assistant and Run Conversation\n\nThis example demonstrates the complete workflow from creating an assistant to running a conversation.\n\n## Step 1: Create an Assistant\n```json\n{\n  \"tool\": \"assistant-create\",\n  \"arguments\": {\n    \"model\": \"gpt-4\",\n    \"name\": \"Code Review Assistant\",\n    \"description\": \"Helps with code review and programming questions\",\n    \"instructions\": \"You are an expert code reviewer. Analyze code for bugs, performance issues, and best practices.\",\n    \"tools\": [{\"type\": \"code_interpreter\"}]\n  }\n}\n```\n\n## Step 2: Create a Thread\n```json\n{\n  \"tool\": \"thread-create\",\n  \"arguments\": {\n    \"metadata\": {\n      \"session_type\": \"code_review\",\n      \"user_id\": \"user123\"\n    }\n  }\n}\n```\n\n## Step 3: Add a Message\n```json\n{\n  \"tool\": \"message-create\",\n  \"arguments\": {\n    \"thread_id\": \"thread_abc123\",\n    \"role\": \"user\",\n    \"content\": \"Please review this Python function for any issues: def calculate_average(numbers): return sum(numbers) / len(numbers)\"\n  }\n}\n```\n\n## Step 4: Run the Assistant\n```json\n{\n  \"tool\": \"run-create\",\n  \"arguments\": {\n    \"thread_id\": \"thread_abc123\",\n    \"assistant_id\": \"asst_abc123\"\n  }\n}\n```\n\n## Step 5: Check Run Status\n```json\n{\n  \"tool\": \"run-get\",\n  \"arguments\": {\n    \"thread_id\": \"thread_abc123\",\n    \"run_id\": \"run_abc123\"\n  }\n}\n```\n\n## Step 6: Get Messages\n```json\n{\n  \"tool\": \"message-list\",\n  \"arguments\": {\n    \"thread_id\": \"thread_abc123\",\n    \"order\": \"asc\"\n  }\n}\n```",
  "metadata": {
    "version": "1.0.0",
    "author": "Jezweb MCP Core Team",
    "lastModified": "2025-01-31T02:45:00.000Z",
    "usage": "workflow-example",
    "size": 1536
  }
}